occupation,occupationLabel,occupationDescription
http://www.wikidata.org/entity/Q6934789,multimedia artist,artist working with different media
http://www.wikidata.org/entity/Q47064,military personnel,people who serve in an organized armed military force
http://www.wikidata.org/entity/Q1483433,laboratory technician,profession
http://www.wikidata.org/entity/Q12013238,ophthalmologist,physician who practices ophthalmology
http://www.wikidata.org/entity/Q4110598,video blogger,type of blogger; person who makes webcast videos
http://www.wikidata.org/entity/Q2576499,nutritionist,person who advises on matters of food and nutrition impacts on health
http://www.wikidata.org/entity/Q4164507,art critic,person who specializes in evaluating art
http://www.wikidata.org/entity/Q18216771,video artist,person who creates video art
http://www.wikidata.org/entity/Q7541856,ceramicist,practitioner of ceramic arts
http://www.wikidata.org/entity/Q19509237,animal rights advocate,
http://www.wikidata.org/entity/Q212238,civil servant,person employed by a government department or agency
http://www.wikidata.org/entity/Q24256017,chairman of the Social Democratic Party,party leader in Austria
http://www.wikidata.org/entity/Q102252389,fourierist,
http://www.wikidata.org/entity/Q27349,dentist,healthcare occupation
http://www.wikidata.org/entity/Q10497074,aerospace engineer,engineering profession
http://www.wikidata.org/entity/Q674426,curator,content specialist charged with a museum's collections and involved with the interpretation of heritage material
http://www.wikidata.org/entity/Q3387717,theatrical director,person overseeing the mounting of a theatre production
http://www.wikidata.org/entity/Q589298,editor-in-chief,publication's editorial leader
http://www.wikidata.org/entity/Q446966,conservator,professional responsible for the preservation of artistic and cultural artifacts
http://www.wikidata.org/entity/Q3140857,horticulturist,"person who works and conducts research in the science and art of growing flowers, fruits, vegetables or ornamental plants"
http://www.wikidata.org/entity/Q1900167,psychotherapist,person who practices psychotherapy
http://www.wikidata.org/entity/Q175151,printer,person involved in manufacturing printed materials; operator of a printing press
http://www.wikidata.org/entity/Q350979,zoologist,someone who studies or practices zoology
http://www.wikidata.org/entity/Q16271064,herpetologist,person studying reptiles or amphibians
http://www.wikidata.org/entity/Q250867,Catholic priest,priest of the Catholic Church
http://www.wikidata.org/entity/Q1454904,voluntary service,institutionalized form of volunteering with limited time for a non-profit cause
http://www.wikidata.org/entity/Q12718544,socialist,supporter of socialism
http://www.wikidata.org/entity/Q217105,political prisoner,someone imprisoned because they have opposed or criticized the government responsible for their imprisonment
http://www.wikidata.org/entity/Q2251335,school teacher,teacher in primary and secondary education
http://www.wikidata.org/entity/Q11741603,People's Commissar,political office-holder which is ecquivalent with the position of the government ministers or secretaries
http://www.wikidata.org/entity/Q5669609,grocer,seller of food
http://www.wikidata.org/entity/Q876864,editing staff,employee who takes on editorial tasks within the media
http://www.wikidata.org/entity/Q12327321,ministerial secretary,
http://www.wikidata.org/entity/Q27431213,cookbook writer,editor who publishes collections of recipes
http://www.wikidata.org/entity/Q29167936,factory inspector,official who checks that factories meet health and safety regulations
http://www.wikidata.org/entity/Q80687,secretary,office occupation
http://www.wikidata.org/entity/Q11995943,Q11995943,
http://www.wikidata.org/entity/Q1056391,head teacher,most senior teacher at a school
http://www.wikidata.org/entity/Q2534525,chairman of the executive board,person in charge of an organization or business
http://www.wikidata.org/entity/Q1251441,leader,someone with the authority to affect the conduct of others; who have the responsibility of leading
http://www.wikidata.org/entity/Q30461,president,"leader of a country or part of a country, usually in republics"
http://www.wikidata.org/entity/Q3029421,publication manager,
http://www.wikidata.org/entity/Q2114605,pharmacologist,"person who studies the manner in which drugs and medications interact with organisms, living systems, and their parts (i.e. cells, tissues, or organs)"
http://www.wikidata.org/entity/Q18581305,beauty pageant contestant,participant in a beauty contest
http://www.wikidata.org/entity/Q17337766,theatre critic,person who writes reviews about theatre performances
http://www.wikidata.org/entity/Q15839134,ecologist,person who works in the scientific field of ecology
http://www.wikidata.org/entity/Q181043,dissident,"person who actively challenges an established doctrine, policy, or institution"
http://www.wikidata.org/entity/Q28721657,Q28721657,
http://www.wikidata.org/entity/Q28948007,Q28948007,
http://www.wikidata.org/entity/Q242468,tailor,"person who makes, repairs, or alters clothing professionally"
http://www.wikidata.org/entity/Q656823,in-home tutor,educator at home
http://www.wikidata.org/entity/Q1662561,paleontologist,scientist specialising in paleontology
http://www.wikidata.org/entity/Q15958754,broadcaster,person working in broadcasting
http://www.wikidata.org/entity/Q1227197,social pedagogue,profession
http://www.wikidata.org/entity/Q125482,imam,Islamic leadership position
http://www.wikidata.org/entity/Q1662050,industrial management assistant,commercial apprenticeship
http://www.wikidata.org/entity/Q17221,spokesperson,someone engaged or elected to speak on behalf of others
http://www.wikidata.org/entity/Q10694573,textile artist,"person who creates art objects using plant, animal, or synthetic fibers"
http://www.wikidata.org/entity/Q30341438,quiltmaker,artisan who makes quilts
http://www.wikidata.org/entity/Q4220892,film critic,journalist who is dealing with films
http://www.wikidata.org/entity/Q11085831,interpreter,person who works with translating and communicating oral texts in different languages
http://www.wikidata.org/entity/Q60233168,political historian,person who is engaged in political history
http://www.wikidata.org/entity/Q1294787,artisan,skilled craft worker who makes or creates things by hand
http://www.wikidata.org/entity/Q4178004,publicist,"person who manages publicity for a public figure, a business or a work"
http://www.wikidata.org/entity/Q15936497,Africanist,profession; specialist in African studies
http://www.wikidata.org/entity/Q26759595,communication scholar,occupation
http://www.wikidata.org/entity/Q13235160,manufacturer,individual or organization that creates goods
http://www.wikidata.org/entity/Q19827218,ultramarathon runner,long distance runner competing in races longer than 42.195 km
http://www.wikidata.org/entity/Q267936,executive director,"chief executive officer (CEO) or managing director of an organization, company, or corporation, who serves as a board member"
http://www.wikidata.org/entity/Q59913751,urban theorist,profession; social scientist specialized in urbanism
http://www.wikidata.org/entity/Q10355417,advertising person,person concerned with the creation of advertisments
http://www.wikidata.org/entity/Q26973007,professor of philosophy,teacher of philosophy at a university or college
http://www.wikidata.org/entity/Q3264451,cardiologist,physician who specializes in cardiology
http://www.wikidata.org/entity/Q2135469,legal counselor,legal professional providing legal advice
http://www.wikidata.org/entity/Q131524,entrepreneur,"business legal entity which organizes and operates an enterprise, in order to conduct economic activity"
http://www.wikidata.org/entity/Q1266283,senior lecturer,academic rank
http://www.wikidata.org/entity/Q1125292,postdoctoral researcher,person professionally conducting research after the completion of their doctoral studies
http://www.wikidata.org/entity/Q16314501,encyclopedist,writer or compiler of encyclopedias
http://www.wikidata.org/entity/Q21993562,cultural activist,occupation
http://www.wikidata.org/entity/Q828395,social policy,measures by governments or institutions which aim to improve or reform society
http://www.wikidata.org/entity/Q2297554,history of feminism,chronological narrative of the movements and ideologies aimed at equal rights for women
http://www.wikidata.org/entity/Q15472169,patron of the arts,person who engages in patronage
http://www.wikidata.org/entity/Q806798,banker,person who manages or owns a bank
http://www.wikidata.org/entity/Q56224063,bookkeeper,profession; person who records the accounts or transactions of a business
http://www.wikidata.org/entity/Q67205775,seamstress,person employed to sew
http://www.wikidata.org/entity/Q2640827,gynaecologist,physician who specialized in gynecology
http://www.wikidata.org/entity/Q356139,proofreader,profession
http://www.wikidata.org/entity/Q47492833,civil libertarian,
http://www.wikidata.org/entity/Q11079476,digital artist,artist who works in the digital medium
http://www.wikidata.org/entity/Q1414443,filmmaker,creator of a cinematic work
http://www.wikidata.org/entity/Q53834886,woman human rights defenders,woman who defends human rights or people who defend women's rights
http://www.wikidata.org/entity/Q3406834,school teacher,primary school teacher in France
http://www.wikidata.org/entity/Q16063546,historian of science,humanist who is engaged in history of science
http://www.wikidata.org/entity/Q736415,conferencier,host of a cabaret or variety show who introduces acts and entertains between them
http://www.wikidata.org/entity/Q37987929,plant ecologist,scientist specializing in the ecology of plants
http://www.wikidata.org/entity/Q1650915,researcher,"person who engages in research, professionally or otherwise. If a more specific occupation is known, use that instead"
http://www.wikidata.org/entity/Q15982858,motivational speaker,speaker intended to motivate the audience
http://www.wikidata.org/entity/Q66288471,trans activist,person who advocates for the rights of transgender people
http://www.wikidata.org/entity/Q99761949,anti-racist,person who opposes racism
http://www.wikidata.org/entity/Q703534,employee,person who works for an employer
http://www.wikidata.org/entity/Q28528560,communist,person who believes that communism can be accomplished
http://www.wikidata.org/entity/Q1459149,schoolmaster,male school teacher
http://www.wikidata.org/entity/Q50940853,school director,the administrative head of a school
http://www.wikidata.org/entity/Q2024200,telegraphist,operator who uses a telegraph key to send and receive the Morse code
http://www.wikidata.org/entity/Q388338,treasurer,person responsible for running the treasury of an organization
http://www.wikidata.org/entity/Q51167455,female supporter of women's right to vote,
http://www.wikidata.org/entity/Q2085381,publisher,company that prints and distributes pressed goods or electronic media
http://www.wikidata.org/entity/Q18810149,stenographer,occupation
http://www.wikidata.org/entity/Q3610436,personal stylist,person who selects or recommends clothing and accessories for a client
http://www.wikidata.org/entity/Q2873500,adventurer,person who seeks adventures
http://www.wikidata.org/entity/Q708492,council member,representative of voters to a local government
http://www.wikidata.org/entity/Q9352089,spy,person engaged obtaining information that is considered secret or confidential
http://www.wikidata.org/entity/Q780596,exhibition curator,person in charge of organising an exhibition
http://www.wikidata.org/entity/Q41583,coach,"person involved in directing, instructing and training sportspeople"
http://www.wikidata.org/entity/Q45217546,Instagram blogger,blogger posting on Instagram
http://www.wikidata.org/entity/Q627325,graphic designer,"professional who assembles images, typography or motion graphics to create a piece of design"
http://www.wikidata.org/entity/Q20873384,historian of classical antiquity,
http://www.wikidata.org/entity/Q22813352,traveler,person who travels or makes voyages
http://www.wikidata.org/entity/Q384593,police officer,warranted employee of a police force
http://www.wikidata.org/entity/Q11937692,Mosso d'Esquadra,officer in the Catalan police
http://www.wikidata.org/entity/Q10297252,crime fiction writer,writer writing fiction about crime
http://www.wikidata.org/entity/Q10547393,local politician,"politician involved in local, as opposed to national, government"
http://www.wikidata.org/entity/Q15634281,virologist,scientist who deals with viruses
http://www.wikidata.org/entity/Q219477,missionary,member of a religious group sent to do evangelism
http://www.wikidata.org/entity/Q5819949,social educator,person whose profession is social education
http://www.wikidata.org/entity/Q386854,drummer,percussionist who creates and accompanies music using drums
http://www.wikidata.org/entity/Q12713481,laborer,low-skilled or unskilled worker in manual-labour occupations and industrial work; usually for a wage
http://www.wikidata.org/entity/Q48705382,syndicalist,"person who promotes syndicalism, an economic system"
http://www.wikidata.org/entity/Q5341297,educational psychologist,profession
http://www.wikidata.org/entity/Q21281706,academic administrator,profession
http://www.wikidata.org/entity/Q33112378,clubwoman,woman active in club-based social or community affairs
http://www.wikidata.org/entity/Q98813131,school psychologist,psychologist that investigates processes of learning and teaching and develops psychological principles and techniques applicable to educational problems
http://www.wikidata.org/entity/Q107983063,women's studies scholar,profession
http://www.wikidata.org/entity/Q7621877,strategist,person with responsibility for the formulation and implementation of a strategy
http://www.wikidata.org/entity/Q2252262,rapper,artist who speaks rhymes in a rhythm over music
http://www.wikidata.org/entity/Q12406482,humorist,intellectual who uses humor in writing or public speaking
http://www.wikidata.org/entity/Q2309784,sport cyclist,someone who competes in the sport of cycling
http://www.wikidata.org/entity/Q2145981,restorer,person who repairs damaged works of art
http://www.wikidata.org/entity/Q5322166,designer,person who designs
http://www.wikidata.org/entity/Q1771040,stringer,freelance journalist
http://www.wikidata.org/entity/Q30131998,cultural anthropologist,scholar of cultural anthropology
http://www.wikidata.org/entity/Q47520669,diplomatician,person who studies the protocols of documents
http://www.wikidata.org/entity/Q17488363,economic historian,humanist who is engaged in economic history
http://www.wikidata.org/entity/Q1155838,correspondent,journalist contributing reports from a remote location
http://www.wikidata.org/entity/Q164236,war correspondent,journalist specializing in coverage of armed conflicts
http://www.wikidata.org/entity/Q1524582,rancher,person who raises livestock on a ranch
http://www.wikidata.org/entity/Q37868118,textbook writer,writers of textbooks
http://www.wikidata.org/entity/Q50768646,labor leader,leader of labor activists
http://www.wikidata.org/entity/Q10509151,primary school teacher,teachers of primary school students
http://www.wikidata.org/entity/Q620413,paralegal,professional of legal science that performs  as part of a legal assistance system
http://www.wikidata.org/entity/Q111535220,nonprofit administrator,profession
http://www.wikidata.org/entity/Q26481809,sports executive,role concerned with the business side of sports
http://www.wikidata.org/entity/Q16060693,conservationist,person who seeks to protect natural resources including animal and plant species as well as their habitat for the future
http://www.wikidata.org/entity/Q5758653,high school teacher,teaching post
http://www.wikidata.org/entity/Q88202189,language activist,
http://www.wikidata.org/entity/Q11571698,independence activist,
http://www.wikidata.org/entity/Q17378128,spoken word artist,writer-performer of spoken word poetry
http://www.wikidata.org/entity/Q24705156,broadcast journalist,journalist working in a broadcast medium such as television or radio
http://www.wikidata.org/entity/Q12797895,occultist,occupation; study of occult practices
http://www.wikidata.org/entity/Q2043121,community service,non-paying job for the benefit of community
http://www.wikidata.org/entity/Q24266767,newspaper proprietor,person owning or publishing a newspaper
http://www.wikidata.org/entity/Q1500610,community leader,person perceived to represent a community
http://www.wikidata.org/entity/Q874894,window dresser,type of retail worker
http://www.wikidata.org/entity/Q2133309,interior designer,"person who designs the interior decoration of a room or building; who plans, researches, coordinates, and manages such projects"
http://www.wikidata.org/entity/Q22811707,decorator,person who decorates for a living
http://www.wikidata.org/entity/Q998550,bookseller,person or other agent selling books
http://www.wikidata.org/entity/Q3427922,restaurateur,person who opens and runs restaurants professionally
http://www.wikidata.org/entity/Q10416136,Q10416136,
http://www.wikidata.org/entity/Q16624872,washerwoman,"service occupation, generally of women"
http://www.wikidata.org/entity/Q1706722,research fellow,employees or officials at a university or a research institute who undertake research
http://www.wikidata.org/entity/Q21546011,labor economist,profession
http://www.wikidata.org/entity/Q116234785,Q116234785,
http://www.wikidata.org/entity/Q1338119,Freiherr,title of nobility in Germany and Scandinavia
http://www.wikidata.org/entity/Q123163947,Q123163947,
http://www.wikidata.org/entity/Q11479517,handicrafter,profession
http://www.wikidata.org/entity/Q17489339,historian of Modern Age,person who studies modern history
http://www.wikidata.org/entity/Q5403434,ethicist,moral principle analyst
http://www.wikidata.org/entity/Q203184,First Lady,honorary title of the wife of a president or head of state
http://www.wikidata.org/entity/Q5673576,gestor,
http://www.wikidata.org/entity/Q55187,hairdresser,person whose occupation is to cut or style hair
http://www.wikidata.org/entity/Q6673651,literary,person who works on literature
http://www.wikidata.org/entity/Q62082534,parliamentary aide,
http://www.wikidata.org/entity/Q1235146,documentary filmmaker,director or producer of documentary films
http://www.wikidata.org/entity/Q6501749,general secretary,leader or chief officer of an organisation
http://www.wikidata.org/entity/Q2393361,dance teacher,occupation
http://www.wikidata.org/entity/Q4991371,soldier,member of the armed forces
http://www.wikidata.org/entity/Q15986539,sports official,official in a sports organization
http://www.wikidata.org/entity/Q2004963,numismatist,"person studying currencies, coins or paper money"
http://www.wikidata.org/entity/Q21694753,semiologist,
http://www.wikidata.org/entity/Q1569495,lecturer,expert who is hired to teach on a full or part time basis
http://www.wikidata.org/entity/Q16012028,legal scholar,researcher who focuses on legal issues
http://www.wikidata.org/entity/Q63677188,law professor,university teacher teaching law
http://www.wikidata.org/entity/Q16626706,family therapist,psychotherapist trained in family therapy
http://www.wikidata.org/entity/Q16254673,pamphleteer,someone who creates or distributes pamphlets
http://www.wikidata.org/entity/Q1235152,documentalist,kind of librarian trained in documentation science and specializing in assisting researchers in their search for scientific and technical documentation
http://www.wikidata.org/entity/Q484876,chief executive officer,highest-ranking corporate officer
http://www.wikidata.org/entity/Q685433,salesperson,person whose job it is to sell things; for property consultant use Q124728671
http://www.wikidata.org/entity/Q2070313,teaching assistant,position
http://www.wikidata.org/entity/Q6817463,mental health counselor,person who works with individuals and groups to promote optimum mental and emotional health
http://www.wikidata.org/entity/Q24716636,volunteer,participant in voluntary work
http://www.wikidata.org/entity/Q937857,association football player,person who plays association football (soccer)
http://www.wikidata.org/entity/Q5803091,shop assistant,occupation
http://www.wikidata.org/entity/Q2058873,slam poet,creator of slam poetry or participant in a poetry slam
http://www.wikidata.org/entity/Q16138122,human rights lawyer,
http://www.wikidata.org/entity/Q19890746,Internet activist,activist whose cause concerns (in part or in whole) the Internet
http://www.wikidata.org/entity/Q2034021,dressmaker,person who makes custom clothing for men and women
http://www.wikidata.org/entity/Q215536,merchant,businessperson who trades in commodities that were produced by others
http://www.wikidata.org/entity/Q486748,pianist,musician who plays the piano
http://www.wikidata.org/entity/Q14915627,musicologist,person who studies music as a branch of knowledge or field of research as distinct from composition or performance
http://www.wikidata.org/entity/Q83307,minister,"politician who holds significant civil public office in a national or regional government, generally heading a ministry"
http://www.wikidata.org/entity/Q85305832,children's rights activist,
http://www.wikidata.org/entity/Q13416803,epidemiologist,researcher on how diseases are spread
http://www.wikidata.org/entity/Q2737906,videographer,person who works in the field of videography
http://www.wikidata.org/entity/Q10265290,Brazilian state deputy,member of a Brazilian federal state Legislative Assembly
http://www.wikidata.org/entity/Q28532974,community organizer,occupation
http://www.wikidata.org/entity/Q1350157,music critic,person who writes reviews about music performances or recordings
http://www.wikidata.org/entity/Q17167049,literary scholar,specialist in study of literature
http://www.wikidata.org/entity/Q3147441,rector,ecclesiastical profession
http://www.wikidata.org/entity/Q1366909,soccer commentator,profession
http://www.wikidata.org/entity/Q2986228,sports commentator,sports broadcaster who comments a live event
http://www.wikidata.org/entity/Q45725048,anti-nuclear activist,
http://www.wikidata.org/entity/Q644687,illustrator,narrative artist who makes images for printed and electronic products
http://www.wikidata.org/entity/Q2419397,therapist,person skilled in a particular kind of therapy
http://www.wikidata.org/entity/Q3104508,cultural manager,"person who promotes, manages, and executes cultural projects or programs"
http://www.wikidata.org/entity/Q202883,veterinarian,"professional who treats disease, disorder, and injury in animals"
http://www.wikidata.org/entity/Q13342461,dog breeder,occupation
http://www.wikidata.org/entity/Q65274801,militiaman,member of a milita
http://www.wikidata.org/entity/Q21234364,radio director,profession; agent responsible for the general management and supervision of a radio program
http://www.wikidata.org/entity/Q2752318,cosmetologist,"person who performs cosmetic treatments to hair, skin, and nails"
http://www.wikidata.org/entity/Q11122954,waka poet,person who composes Waka or Tanka
http://www.wikidata.org/entity/Q1328668,gravure idol,"Japanese female model who models for magazines, photobooks or movies, intended to be provocative or suggestive"
http://www.wikidata.org/entity/Q48282,student,"learner, or someone who attends an educational institution"
http://www.wikidata.org/entity/Q860918,Esperantist,person speaking or using the international language Esperanto
http://www.wikidata.org/entity/Q520549,geologist,scientist who studies geology
http://www.wikidata.org/entity/Q2312637,physical education teacher,occupation
http://www.wikidata.org/entity/Q11513337,athletics competitor,"sportsperson that competes in athletics (track and field, running, walking)"
http://www.wikidata.org/entity/Q2599593,germanist,scholar specialising in the German language or culture or literature
http://www.wikidata.org/entity/Q3640160,marine biologist,scientist specializing in marine biology
http://www.wikidata.org/entity/Q28004591,professeur des universités,"type of position in French university, that gives the ""professor"" title"
http://www.wikidata.org/entity/Q822146,lyricist,writer of song lyrics
http://www.wikidata.org/entity/Q852389,beekeeper,person who keeps honey bees
http://www.wikidata.org/entity/Q373085,chancellor,executive position in a government
http://www.wikidata.org/entity/Q1919436,pediatrician,physician with medical specialty pediatrics
http://www.wikidata.org/entity/Q3332711,medievalist,"historian, scientist or expert in medieval studies"
http://www.wikidata.org/entity/Q26701778,health administrator,administrator working in the health sector
http://www.wikidata.org/entity/Q1331070,abortion-rights movement,social movement advocating for legal access to induced abortion services
http://www.wikidata.org/entity/Q100552979,history-geography teacher,
http://www.wikidata.org/entity/Q805221,ballet dancer,person who practices the art of ballet
http://www.wikidata.org/entity/Q1323191,costume designer,"person who designs costumes for a film, stage production or television show"
http://www.wikidata.org/entity/Q2490358,choreographer,person who creates choreographies
http://www.wikidata.org/entity/Q1419997,event producer,"person specializing in planning and execution of parties, events, exhibitions, meetings, conventions, weddings and other things"
http://www.wikidata.org/entity/Q12716775,Marxist,person who supports Marxism
http://www.wikidata.org/entity/Q48930480,philosophy teacher,teacher of philosophy at any level
http://www.wikidata.org/entity/Q713200,performing artist,"artist who participates in performing arts in front of an audience: actors, comedians, dancers, magicians, circus artists, musicians, singers"
http://www.wikidata.org/entity/Q12336252,social entrepreneur,occupation
