occupation,occupationLabel,occupationDescription
http://www.wikidata.org/entity/Q630993,bertsolari,"profession; a singer of bertso, a musical verse in Basque tradition"
http://www.wikidata.org/entity/Q897359,day labourer,worker hired and paid one day at a time
http://www.wikidata.org/entity/Q60456278,secularist,"one who, discarding as irrelevant all theories bearing upon the other world, holds that we ought to confine our attention solely to the immediate problems and duties of this, independently of all presumed dependence on revelation from a higher sphere"
http://www.wikidata.org/entity/Q583271,spiritual medium,person said to mediate communication between spirits of the dead and other human beings
http://www.wikidata.org/entity/Q1726903,criminalist,profession
http://www.wikidata.org/entity/Q10272925,agricultural engineer,engineering profession
http://www.wikidata.org/entity/Q66300521,nurse administrator,nurse professionally qualified in administration
http://www.wikidata.org/entity/Q106399618,nationalist,person advocating national independence or a strong national government
http://www.wikidata.org/entity/Q7623053,street protester,person partaking in a public protest against a cause of concern
http://www.wikidata.org/entity/Q21477194,contemporary artist,artist of the 20th century or in the 21st century
http://www.wikidata.org/entity/Q7888586,chemical engineer,professional in the field of chemical engineering
http://www.wikidata.org/entity/Q101067779,environmental defender,individual or group that strives to protect and promote human rights relating to the environment
http://www.wikidata.org/entity/Q1737057,Q1737057,
http://www.wikidata.org/entity/Q56404221,holder of the procuration,"person who has power of attorney from a businessman or a company to enter into contracts on their behalf, and cannot transfer the power of attorney to another person"
http://www.wikidata.org/entity/Q1072363,chief officer,highest-ranked corporate officer of a given type
http://www.wikidata.org/entity/Q4504549,religious servant,member of a religious community
http://www.wikidata.org/entity/Q23670153,president of a non-profit organisation,
http://www.wikidata.org/entity/Q18545066,stand-up comedian,comedian of stand-up comedy
http://www.wikidata.org/entity/Q101444601,French teacher,person who teaches the French language
http://www.wikidata.org/entity/Q63619823,abortion rights activist,person who advocates for the right to abortion
http://www.wikidata.org/entity/Q12008505,academic librarian,librarian of an academic library
http://www.wikidata.org/entity/Q61857538,disability rights activist,activist or advocate for the civil rights of people with disabilities
http://www.wikidata.org/entity/Q124516127,para table tennis player,sportsperson taking part in para table tennis competitions
http://www.wikidata.org/entity/Q1122364,indentured servant,ostensibly temporary slave via contract
http://www.wikidata.org/entity/Q96036530,health activist,person campaigning in favour of health and access to health care
http://www.wikidata.org/entity/Q11814411,documentarian,author of documentaries
http://www.wikidata.org/entity/Q715301,comics artist,person who creates the artwork for comics
http://www.wikidata.org/entity/Q1906857,mechanical engineer,specialized engineer
http://www.wikidata.org/entity/Q832136,business manager,"person who manages the business affairs of an individual, institution, organization, or company"
http://www.wikidata.org/entity/Q12031226,founder,worker specialized in metal casting
http://www.wikidata.org/entity/Q1954956,musical theatre actor,actor and singer performing in musical theatre
http://www.wikidata.org/entity/Q7063944,railway worker,occupation related to railroad networking
http://www.wikidata.org/entity/Q10535290,manufacturing worker,"person which is directly involved in manufacturing, i.e. hands-on"
http://www.wikidata.org/entity/Q23038345,Wikipedian,contributor to Wikipedia
http://www.wikidata.org/entity/Q29392795,psychopedagogue,
http://www.wikidata.org/entity/Q156839,cook,occupation involving cooking food
http://www.wikidata.org/entity/Q211423,goldsmith,metalworker who specializes in working with gold and other precious metals
http://www.wikidata.org/entity/Q500251,ship-owner,businessperson who owns or charters ships
http://www.wikidata.org/entity/Q12307965,debater,person who participates in a debate
http://www.wikidata.org/entity/Q2468727,classical scholar,"person who studies classics, the culture of (mainly) Ancient Greece and Ancient Rome"
http://www.wikidata.org/entity/Q140686,chairperson,"leading or presiding officer of an organized group such as a board, committee, or deliberative assembly"
http://www.wikidata.org/entity/Q1114448,cartoonist,"visual artist who creates cartoons (single images, animation film stills, comics, graphic novels and so on), not necessarily in a humorous style"
http://www.wikidata.org/entity/Q2055046,physiologist,scientist who studies the function of living systems
http://www.wikidata.org/entity/Q4531850,endocrinologist,scientist who studies the endocrine system
http://www.wikidata.org/entity/Q381160,expert,person with broad and profound competence in a particular field
http://www.wikidata.org/entity/Q15837695,organizational consulting,external guidance to improve the structure and processes in an organization
http://www.wikidata.org/entity/Q42673468,naturopath,profession
http://www.wikidata.org/entity/Q1749879,pensioner,"person who collects a pension, most commonly because of a retirement from the workforce"
http://www.wikidata.org/entity/Q1113899,clinical psychologist,profession
http://www.wikidata.org/entity/Q17504992,social historian,humanist who is engaged in social history
http://www.wikidata.org/entity/Q95918159,consumer rights activist,
http://www.wikidata.org/entity/Q2906862,influencer,person who uses their social media activity to influence buying decisions
http://www.wikidata.org/entity/Q7886765,union organizer,specific type of trade union member (often elected) or an appointed union official
http://www.wikidata.org/entity/Q47262408,Q47262408,
http://www.wikidata.org/entity/Q901222,tutor,instructor who gives private lessons
http://www.wikidata.org/entity/Q2500638,creator,person who does creative work
http://www.wikidata.org/entity/Q2313151,house servant,worker within an employer's household
http://www.wikidata.org/entity/Q466640,horse trainer,"person training horses for racing, riding, show or work"
http://www.wikidata.org/entity/Q58287519,video game developer,person responsible for developing video games
http://www.wikidata.org/entity/Q18931911,theorist,person who develops theories in a field
http://www.wikidata.org/entity/Q19890761,artivist,occupation
http://www.wikidata.org/entity/Q2478141,aristocrat,a person who either possesses hereditary titles granted by a monarch or is related to such people
http://www.wikidata.org/entity/Q17048963,advokat,lawyers who practise in the Nordic countries
http://www.wikidata.org/entity/Q101539,flight attendant,position in an aircrew
http://www.wikidata.org/entity/Q58209937,history teacher,profession
http://www.wikidata.org/entity/Q3014296,motorcycle racer,person who for their profession or a hobby participates in competitions with a motorcycle
http://www.wikidata.org/entity/Q16271261,malacologist,scientist who studies molluscs
http://www.wikidata.org/entity/Q1502514,cooperative movement,
http://www.wikidata.org/entity/Q93429096,technical editor,Processing editor of a peer reviewed publication (exact role varies between journals)
http://www.wikidata.org/entity/Q11986654,lobbyist,person involved in lobbying
http://www.wikidata.org/entity/Q3406651,radio producer,person who supervises the production of a radio show
http://www.wikidata.org/entity/Q19607300,television columnist,
http://www.wikidata.org/entity/Q15978655,consultant,professional who provides advice in their specific field of expertise; for property consultant use Q124728671; for adviser who is part of leadership use Q2994387
http://www.wikidata.org/entity/Q59071295,Catholic propagandist,
http://www.wikidata.org/entity/Q22082717,eugenicist,researcher or promoter of eugenics
http://www.wikidata.org/entity/Q106675732,legal author,occupation
http://www.wikidata.org/entity/Q53457571,Zionist leader,
http://www.wikidata.org/entity/Q3408848,lay preacher,preacher who is not a member of the clergy
http://www.wikidata.org/entity/Q8354948,children's rights,human rights of children
http://www.wikidata.org/entity/Q1861368,tattoo artist,individual who injects tattoo ink
http://www.wikidata.org/entity/Q2505739,hispanist,scholar specialising in Hispanic studies
http://www.wikidata.org/entity/Q16023925,storyteller,one who tells stories (not a narrator)
http://www.wikidata.org/entity/Q913603,Bachelor of Social Work,entry-level degree in public welfare
http://www.wikidata.org/entity/Q11993231,Norwegian public servant,"defined within a national Norwegian context, this type of official is employed by the state at a lower level of government"
http://www.wikidata.org/entity/Q27943370,fashion person,person active in the world of fashion
http://www.wikidata.org/entity/Q2449921,drama teacher,"educator who teaches one or more aspects of drama (e.g., theatre history, acting, directing)"
http://www.wikidata.org/entity/Q3127709,harpist,musician who plays the harp
http://www.wikidata.org/entity/Q98552221,plastic artist,practitioner of plastic arts
http://www.wikidata.org/entity/Q19513109,Dutch language specialist,
http://www.wikidata.org/entity/Q3029404,hospital administrator,managerial position responsible for implementing policy and directing the activities of a hospital
http://www.wikidata.org/entity/Q357813,adjunct professor,academic title or rank typically indicating non-full time employment as a professor
http://www.wikidata.org/entity/Q28134462,transgender sex workers,
http://www.wikidata.org/entity/Q901,scientist,person who use scientific methods to study in an area of interest
http://www.wikidata.org/entity/Q1113838,climatologist,scientist who studies climate
http://www.wikidata.org/entity/Q1414937,combatant,person who takes a direct part in the hostilities of an armed conflict
http://www.wikidata.org/entity/Q29381289,user interface designer,person working in the field of user interface design
http://www.wikidata.org/entity/Q1108818,chartered accountant,occupation
http://www.wikidata.org/entity/Q816432,project manager,professional in the field of project management
http://www.wikidata.org/entity/Q19768301,market researcher,profession
